{
  "_schema": "tt-image-inventory/v1",
  "_generator": "release/generate-image-pins.sh",
  "generated_at": "2026-03-15T12:06:30Z",
  "tt_version": "v14.0",
  "images": [
    {
      "image_ref": "postgres",
      "source_tag": "16.6-alpine",
      "resolved_digest": "sha256:1d04b9ba1d4996401f2552b51beda8187f175c0645c091e4781134fc9c9a3eef",
      "digest_status": "resolved",
      "scope": "core",
      "profile_dependency": null,
      "compose_file": "tt-core/compose/tt-core/docker-compose.yml",
      "service_name": "postgres",
      "locked_at": "2026-03-15T12:06:40Z"
    },
    {
      "image_ref": "postgres",
      "source_tag": "16.6-alpine",
      "resolved_digest": "sha256:1d04b9ba1d4996401f2552b51beda8187f175c0645c091e4781134fc9c9a3eef",
      "digest_status": "resolved",
      "scope": "core",
      "profile_dependency": null,
      "compose_file": "tt-core/compose/tt-core/docker-compose.yml",
      "service_name": "db-provisioner",
      "locked_at": "2026-03-15T12:06:44Z"
    },
    {
      "image_ref": "redis",
      "source_tag": "7.4-alpine",
      "resolved_digest": "sha256:8b81dd37ff027bec4e516d41acfbe9fe2460070dc6d4a4570a2ac5b9d59df065",
      "digest_status": "resolved",
      "scope": "core",
      "profile_dependency": null,
      "compose_file": "tt-core/compose/tt-core/docker-compose.yml",
      "service_name": "redis",
      "locked_at": "2026-03-15T12:06:48Z"
    },
    {
      "image_ref": "n8nio/n8n",
      "source_tag": "1.88.0",
      "resolved_digest": "sha256:ba7d74b07f6b87e622c67f8ca665dda269a8d15e2bef355d3604d597a92798c9",
      "digest_status": "resolved",
      "scope": "core",
      "profile_dependency": null,
      "compose_file": "tt-core/compose/tt-core/docker-compose.yml",
      "service_name": "n8n",
      "locked_at": "2026-03-15T12:06:52Z"
    },
    {
      "image_ref": "n8nio/n8n",
      "source_tag": "1.88.0",
      "resolved_digest": "sha256:ba7d74b07f6b87e622c67f8ca665dda269a8d15e2bef355d3604d597a92798c9",
      "digest_status": "resolved",
      "scope": "core",
      "profile_dependency": null,
      "compose_file": "tt-core/compose/tt-core/docker-compose.yml",
      "service_name": "n8n-worker",
      "locked_at": "2026-03-15T12:06:57Z"
    },
    {
      "image_ref": "dpage/pgadmin4",
      "source_tag": "8.14",
      "resolved_digest": "sha256:8a68677a97b8c8d1427dc915672a26d2c4a04376916a68256f53d669d6171be7",
      "digest_status": "resolved",
      "scope": "core",
      "profile_dependency": null,
      "compose_file": "tt-core/compose/tt-core/docker-compose.yml",
      "service_name": "pgadmin",
      "locked_at": "2026-03-15T12:07:00Z"
    },
    {
      "image_ref": "redis/redisinsight",
      "source_tag": "2.66",
      "resolved_digest": "sha256:e3af8fca1272243632adba175af4db0c439618f83649d8a12bbf617d3c9ff284",
      "digest_status": "resolved",
      "scope": "core",
      "profile_dependency": null,
      "compose_file": "tt-core/compose/tt-core/docker-compose.yml",
      "service_name": "redisinsight",
      "locked_at": "2026-03-15T12:07:04Z"
    },
    {
      "image_ref": "metabase/metabase",
      "source_tag": "v0.52.9",
      "resolved_digest": "sha256:2effc7da989f298312e005430af27a5668e34f77f7a82e5f56504131f14b32c0",
      "digest_status": "resolved",
      "scope": "core",
      "profile_dependency": null,
      "compose_file": "tt-core/compose/tt-core/docker-compose.yml",
      "service_name": "metabase",
      "locked_at": "2026-03-15T12:07:09Z"
    },
    {
      "image_ref": "qdrant/qdrant",
      "source_tag": "v1.13.4",
      "resolved_digest": "sha256:318c11b72aaab96b36e9662ad244de3cabd0653a1b942d4e8191f18296c81af0",
      "digest_status": "resolved",
      "scope": "core",
      "profile_dependency": null,
      "compose_file": "tt-core/compose/tt-core/docker-compose.yml",
      "service_name": "qdrant",
      "locked_at": "2026-03-15T12:07:13Z"
    },
    {
      "image_ref": "ollama/ollama",
      "source_tag": "0.6.5",
      "resolved_digest": "sha256:96b7667cb536ab69bfd5cc0c2bd1e29602218e076fe6d34f402b786f17b4fde0",
      "digest_status": "resolved",
      "scope": "core",
      "profile_dependency": null,
      "compose_file": "tt-core/compose/tt-core/docker-compose.yml",
      "service_name": "ollama",
      "locked_at": "2026-03-15T12:07:17Z"
    },
    {
      "image_ref": "cloudflare/cloudflared",
      "source_tag": "2025.2.1",
      "resolved_digest": "sha256:03737f27c38ecfb257a55664953cac510727cf27052c51ddb7c8ff1a2b9969e1",
      "digest_status": "resolved",
      "scope": "tunnel",
      "profile_dependency": null,
      "compose_file": "tt-core/compose/tt-tunnel/docker-compose.yml",
      "service_name": "cloudflared",
      "locked_at": "2026-03-15T12:07:21Z"
    },
    {
      "image_ref": "edoburu/pgbouncer",
      "source_tag": "1.22.1-p0",
      "resolved_digest": "sha256:7f39cf2f872c8d9a0bb0e6a5440c3bf5814036eccf284102870ab08e2603a2c7",
      "digest_status": "resolved",
      "scope": "addon",
      "profile_dependency": "pgbouncer",
      "compose_file": "tt-core/compose/tt-core/addons/05-pgbouncer.addon.yml",
      "service_name": "pgbouncer",
      "locked_at": "2026-03-15T12:07:26Z"
    },
    {
      "image_ref": "wordpress",
      "source_tag": "6.7.2-php8.3-apache",
      "resolved_digest": "sha256:10f35d0dd608ee9f907c22aa3f2bbb9ac64fee72726503e53f2afd298d2a09f1",
      "digest_status": "resolved",
      "scope": "addon",
      "profile_dependency": "wordpress",
      "compose_file": "tt-core/compose/tt-core/addons/05-wordpress.addon.yml",
      "service_name": "wordpress",
      "locked_at": "2026-03-15T12:07:30Z"
    },
    {
      "image_ref": "mariadb",
      "source_tag": "11.8.6",
      "resolved_digest": "sha256:8164f184d16c30e2f159e30518113667b796306dff0fe558876ab1ff521a682f",
      "digest_status": "resolved",
      "scope": "addon",
      "profile_dependency": "wordpress",
      "compose_file": "tt-core/compose/tt-core/addons/05-wordpress.addon.yml",
      "service_name": "mariadb",
      "locked_at": "2026-03-15T12:07:34Z"
    },
    {
      "image_ref": "ghcr.io/open-webui/open-webui",
      "source_tag": "v0.5.20",
      "resolved_digest": "sha256:92b238e6c27dc6dacda7769062444044ed71b78628e0a9810ba5cea25e0e1ba0",
      "digest_status": "resolved",
      "scope": "addon",
      "profile_dependency": "openwebui",
      "compose_file": "tt-core/compose/tt-core/addons/20-openwebui.addon.yml",
      "service_name": "openwebui",
      "locked_at": "2026-03-15T12:07:37Z"
    },
    {
      "image_ref": "louislam/uptime-kuma",
      "source_tag": "1.23.17",
      "resolved_digest": "sha256:3d632903e6af34139a37f18055c4f1bfd9b7205ae1138f1e5e8940ddc1d176f9",
      "digest_status": "resolved",
      "scope": "addon",
      "profile_dependency": "uptime-kuma",
      "compose_file": "tt-core/compose/tt-core/addons/30-uptime-kuma.addon.yml",
      "service_name": "uptime-kuma",
      "locked_at": "2026-03-15T12:07:42Z"
    },
    {
      "image_ref": "portainer/portainer-ce",
      "source_tag": "2.39.0-alpine",
      "resolved_digest": "sha256:f56ef070ee60896039fcb219e639da6c1a0cdc726f0bf2eb5c124d33a1c78bf4",
      "digest_status": "resolved",
      "scope": "addon",
      "profile_dependency": "portainer",
      "compose_file": "tt-core/compose/tt-core/addons/40-portainer.addon.yml",
      "service_name": "portainer",
      "locked_at": "2026-03-15T12:07:46Z"
    },
    {
      "image_ref": "minio/minio",
      "source_tag": "RELEASE.2025-01-20T14-49-07Z",
      "resolved_digest": "sha256:ed9be66eb5f2636c18289c34c3b725ddf57815f2777c77b5938543b78a44f144",
      "digest_status": "resolved",
      "scope": "addon",
      "profile_dependency": "minio",
      "compose_file": "tt-core/compose/tt-core/addons/60-minio.addon.yml",
      "service_name": "minio",
      "locked_at": "2026-03-15T12:07:51Z"
    },
    {
      "image_ref": "prom/prometheus",
      "source_tag": "v2.51.2",
      "resolved_digest": "sha256:4f6c47e39a9064028766e8c95890ed15690c30f00c4ba14e7ce6ae1ded0295b1",
      "digest_status": "resolved",
      "scope": "addon",
      "profile_dependency": "monitoring",
      "compose_file": "tt-core/compose/tt-core/addons/70-monitoring.addon.yml",
      "service_name": "prometheus",
      "locked_at": "2026-03-15T12:07:55Z"
    },
    {
      "image_ref": "grafana/grafana",
      "source_tag": "10.4.2",
      "resolved_digest": "sha256:7d5faae481a4c6f436c99e98af11534f7fd5e8d3e35213552dd1dd02bc393d2e",
      "digest_status": "resolved",
      "scope": "addon",
      "profile_dependency": "monitoring",
      "compose_file": "tt-core/compose/tt-core/addons/70-monitoring.addon.yml",
      "service_name": "grafana",
      "locked_at": "2026-03-15T12:07:59Z"
    },
    {
      "image_ref": "qdrant/qdrant",
      "source_tag": "v1.9.2",
      "resolved_digest": "sha256:21086aeaedfd8276cc8b94cb695079ba75d1cd6614d6689bf82e72c214781a46",
      "digest_status": "resolved",
      "scope": "addon",
      "profile_dependency": "qdrant",
      "compose_file": "tt-core/compose/tt-core/addons/80-qdrant.addon.yml",
      "service_name": "qdrant",
      "locked_at": "2026-03-15T12:08:03Z"
    },
    {
      "image_ref": "supabase/postgres",
      "source_tag": "15.8.1.085",
      "resolved_digest": "sha256:af083ef64d0408c8f098ee6f5c364a59b26f36fbc0f3a334a62c5c1d57362e9b",
      "digest_status": "resolved",
      "scope": "companion",
      "profile_dependency": "tt-supabase",
      "compose_file": "tt-supabase/compose/tt-supabase/docker-compose.yml",
      "service_name": "db",
      "locked_at": "2026-03-15T12:08:08Z"
    },
    {
      "image_ref": "supabase/logflare",
      "source_tag": "1.31.2",
      "resolved_digest": "sha256:100a142653f9d78a6724cca716f3e68e84e8d8cf0ccbf868b82e8d29ebfad549",
      "digest_status": "resolved",
      "scope": "companion",
      "profile_dependency": "tt-supabase",
      "compose_file": "tt-supabase/compose/tt-supabase/docker-compose.yml",
      "service_name": "analytics",